text,label
i feel as though i am living the world of opposites where a long cold winter is a sign of global warming free speech is only free as long as it is practiced in the echo chamber of political correctness and the u,3
i got a feeling give it up i got a feeling get away becuz i m cuz i m dangerous oh i m a badman ah,3
i am overly passionate but i love music for how it makes me feel i connect with the songs and the artists and i am amazed and truly in awe of those that can write a song that touches me,5
i feel tortured by this sense of wrong,4
i feel empty and lonely i want to cry but i cant i want to scream and im afraid to,0
i was washing the trees hoping it would do some good and concurrently in the general trajectory of my life feeling more and more suspicious of much of the trappings of christianity and even sometimes maybe just kinda or a lot suspicious of its heart and in my head is this song,4
im sure most moms have already figured this out but i feel like such a more joyful person,1
i look forward to when i am feeling better and can write more often,1
i wanna talk tell you about sycf it stands for singapore youth chinese forum btw and although theres a singapore word inside i feel like the minority there p ok but thats beside the point,1
i feel that npr provides a valuable service,1
i have no better word to describe the way i feel than heartbroken,0
i use it regularly with relaxing music and always feel invigorated afterward,1
i am learning is one of my default reactions when i feel threatened,4
im not feeling real strong lately,1
i don t know what it feels like to be in love so i m starting to get scared that i don t actually love him,4
i never thought i could feel thankful for such an awful thing but i am for making me stronger even as my husband gets weaker,1
i feel stumped something comes out of my pen and im always a little amazed by this,5
i will make you feel amazing tonight i need you no,5
i feel funny telling you about my name change anyway gracias por todo,5
i feel cool calm and collected,1
i don t want him to feel disrespected or unloved,0
i feel the language of the warning is pretty benign but i am open to your suggestions on how to improve it,1
i would further suggest people might feel more at ease in caring giving societies,2
i feel like ending my life like some song from damaged or something,0
i feel so thankful to have been able to be apart of the one in the bay area,1
is only friend made yuuki feel special,1
i feel unimportant and undesired,0
i was feeling as if i am in the lap of the divine mother and she is holding me in her soft and tender arms,1
i especially have trouble socializing with females now before i moved away from my friends and family i actually preferred being with my female friends than with my male friends simply because i did not enjoy feeling like i had to offset my effeminacy and repressed homosexuality,0
i just feel so unsure of myself and everything in my life,4
i was feeling very vulnerable and down no one really close to me has ever died before i either hadnt known them very well or was too young to remember,4
i think that we must continue to seek each other s good even as we feel offended and to always look for ways to go lower and walk in the humility that jesus walked in,3
i feel like in order to live a compassionate life this is an essential piece of the puzzle for me,2
i was tired sore and didnt really feel like makin the mile trip to church i was ecstatic to be there and enjoyed every minute of it,1
ive been really into the more laid back bohemian feeling style and thought these items would be perfect for a beachy california trip,1
im feeling really lethargic and weird today,0
i really enjoyed feeling that i was not alone,0
im so full of life i feel appalled,3
i feel petty posting with my own complaints right now because its not like i was kidnapped when i was years old and forced to make easter creme eggs for the rest of my life,3
im not mistaken all the thai business leaders at the dinner feel ashamed about the setbacks that have held thailand back from its full potential,0
i kept thinking that if i had the right mindset if i put enough effort into pushing away the feelings then i would not be afraid,4
i feel bad for the creature,0
i feel that is very unfortunate that i dont own the soundtrack,0
i feel distracted when people think i m overreacted,3
i have a feeling my view isnt going to be very popular and thats fine,1
i feel troubled and also terrified your minute my partner and i view hundreds of white jackets and obtain caught from the surgeons evaluating area sterile and clean smelling and brimming with numerous devices,0
i feel to it and it benefits from a generous budget for exotic sets and gorgeous matte paintings,2
im a little concerned that ill look up one day and all the leaves will be on the ground and ill feel like i missed it,0
i had been feeling conflicted and disheartened by my choice to get a new job even though i know this is what god has for me right now,0
i was feeling especially ungrateful its just that i had no alone time to post anything,0
i still feel mentally in the game but a string of unfortunate events most i haven t written about had me sitting on the sidelines temporarily,0
i don t feel as relaxed when i sleep because of this,1
i feel useless because i feel like i should have dealt with this ages ago,0
i was really upset when he went away though i can understand how he must feel and i wont be greedy and pester him about it,3
im going through some feels today and ive got to admit theyre pretty unpleasant,0
i think it s the easiest time of year to feel dissatisfied,3
i feel like i have missed out on every single holiday last year so we are hitting it hard this year,0
i had just lost my uncle i would be sad but i feel as if i am devastated,0
i hate feeling so indecisive about things because i keep my emotions under lock and key,4
i feel even more empty,0
i are feeling somewhat indecisive about what we want to do to celebrate our anniversary,4
i have been feeling grumpy for the past few days and i just dont feel like being my upbeat self here on my blog,3
i remember watching it and feeling devastated because of the sheer familiarity of it all,0
ive told friends and fellow fans i feel like weve all been partaking in a delicious feast these last seasons and now were about to get that last really fine meal,1
i am not holding in my anger but i am holding it back so that i can still choose with a clearer mind and can feel it without executing someone for something petty,3
i feel all glamorous,1
im going to help you in this so if you feel that regretful then buy me an ice cream the next time we see each other,0
i am ready to cry because i feel such a sweet presence of the ruach hakodesh the holy spirit in my room with me right now,1
i am feeling irate,3
i hope something magical happens today because im feeling kind of listless,0
im still feeling terrible even though ive had some good days,0
i feel irritated to have missed out direct instruction from master lee is never to be passed up casually i have to admit my body just feels like it needs the rest,3
i feel always a tad bit more troubled at the conclusion with the days due to the fact i really often desire to hit my personal sales aim at the office,0
im wrong but i have a feeling the studio was reluctant to give clint money to fund a movie from the perspective of the japanese,4
i do however feel a bit envious of people who have different perfumes for different seasons,3
i feel there are a lot of things that i need want must to do but always somehow got distracted got a call from my crol tl and just told her that couldnt join her as per going to the doc,3
i spent a few hours listening to the thundershowers and feeling that gorgeous cool summer storm air across my ginormous pregnant self,1
i am feeling honored grateful and blessed to get to spend each day with these remarkable th graders,1
i feel like im tortured like years ago,4
im kind of feeling nervous and anxious about all the shit i have to do today,4
i began feeling amorous towards everyone on stage towards the people around me as i experienced the moment with them,2
i allowed people tonight to make me feel as though i was far less superior to them because i felt less attractive less popular and less able to be part of a community,1
i can make him feel a christ isnt he the most delicious creature youve ever seen,1
i made to take my mind of feeling soooo rotten,0
i feel i am with ampatuan and joining the forces of hell bitchy human who only wants is to spread their worst odor in this world,3
i friends helping them to dress up and practise their thai introduction session while i sat there feeling helpless,4
i feel this triumphant pride as i stand at the counter like i am achieving some high level male honor because i am a female doing this a redhead to boot,1
i shall never rest until each and every ukrainian will feel that he she is a precious part of an inclusive ukrainian society whose historical roots have always been diverse and multi national language issue,1
i didnt feel humiliated,0
im meant to feel longing,2
i read in the book called the mindful woman that every so often throughout your day you should stop and close your eyes and think about anything that you can hear or see or smell or feel its kind of a cool experiment,1
i know there sad to read but it lets other women who feel alone about it,0
i don t feel bitter about my lot nor do i wish any other mother s son was in my place,3
i feel like i m trying to be that guy who hangs out with curious george,5
i feel like shes just so distracted but when it comes to my year old brother she waits on him hand and foot,3
i was feeling creative and making things better in my house,1
i feel an aching tiredness that goes down to my core,0
i was so stubborn and that it took you getting hurt for me to admit even to myself how i feel i haven t been very considerate of you in that respect,1
im feeling quite mellow now in spite of having raging pms the past few days which means im likely to erupt with little or no warning,1
i go to little tiny andover and take a walk at night i feel absolutely terrified,4
i talk to you i feel like a lot gets resolved,1
i hated the day job and after a few months of feeling like i was being cosmically punished for doing a good deed i was getting ready to quit when i met the woman that would become my wife,0
i continued to feel this way for the next couple weeks until i convinced myself i should just take a pregnancy test to be sure,1
i got an overall dark and uncomfortable feeling as we chose to stay until the end as not to disrupt or be rude,3
i happened to see the videotape movie this is america part one at my friends place,3
i just hate to feel unhappy emotions,0
i read other peoples posts there are moments where i feel id give my left fingernail to be them my left fingernail is precious because its the only one i can polish perfectly out of the,1
i keep feeling pleasantly surprised at his supportiveness and also his ease in new situations,5
im feeling playful google doodle of pac man game,1
i put it aside feeling a little defeated,0
i feel longing in myself or see it in others it rises up as a need that will never be quenched a desire never to be extinguished,2
i go with their flow i always feel shitty so i do what fits me best,0
i wanted to go and ask him about my batting but was feeling hesitant about approaching such a big player,4
i have gained lbs back and i feel terrible about it,0
i feel so idiotic for letting you and myself call us best friends,0
i feel nervous when i think about going to australia though i feel exited at the same time,4
ive got no brothers in the family i feel incredibly blessed to be gifted with sisters who drive me up the wall and who also happens to be the ones who make me feel most comfortable being myself,1
i am reliving all of the feelings of being rejected less than and not good enough from years ago,0
im feeling ugly lately,0
i know i totes feel like a valued and equal person to my coworkers while theyre laughing over shutting women up,1
i attributed this depression to feeling inadequate against the unrealistic ideals of the lds church and while i still hold those ideals somewhat responsible i recognize this pattern of behavior,0
i expressed my concerns that jens mobility had really declined to the point that she now sometimes uses crutches and on a good day the doctor suggested occupational therapy and said he would contact our local occupational therapist and we went on our merry way feeling rather disheartened,0
im feeling pretty contented too having an instructor to assist me with higher level math again for a while is very helpful,1
i am concerned that my gut feeling about not dropping aol that quickly about not trusting verizon was not just paranoia,1
im feeling awful because we hung out with my friend and her new baby the day before,0
i have a feeling that the smell is not going to be pleasant,1
i have to emphasize the feeling of lost and found,0
i am feeling called to show up in a more faithful way,2
i went by on wednesday feeling slightly regretful that i didnt try to haggle,0
i hate feeling discontent but its what im feeling right now and im tired of hiding it,0
im feeling shy im feeling mad im feeling sad,4
i felt that aching feeling anymore and i had to think about it but no i dont have that aching feeling unless i am missing my family,0
i lets me into his fucked up world and he usually does i feel fucked up too and honestly a little scared,3
i miss marching and saluting more than anything but i feel like in order to be successful i need to get my grades together first and then worry about other things,1
i feel as if im in some strange catholic vortex,5
im feeling irritated by her friggin name,3
i feel the isolation and despair of the rejected,0
i feel like i am totally trusting someone my soul cannot submit to that and so walls go up and the restlessness never ends,1
i am trying to work on finding the joy in the simple thing that god is finding joy in my obedience to him even if it doesn t feel very joyful in the way that i am used to,1
i feel humiliated to introduce you to my colleagues as my wife,0
i this feels rebellious to me,3
i feel so embarrassed of myself for even having the nerve to post them all up for everyone else to read,0
i still didnt start feeling contractions but it was a tender mercy for me because she would have come on the st no matter what,2
i wish it had been a little more and this makes me feel greedy and sheepish and lazy for not having worked harder over the last few months,3
i feel stressed he gets upset for that too,3
i have still been feeling numb i cant feel myself chewing or swallowing food,0
i feel so so tortured by looking at the lecture notes and nothing is going in except for my holiday plans,3
im feeling the need for a cute little monogrammed one in green for mommy,1
i love to add just a little milk and when i m feeling especially naughty a splash of caramel and vanilla syrup but shhh,2
i started this blog is because i was desperately lonely and i wanted someone to know how i was feeling all of the ugly thoughts and emotions,0
i feel like an idiot around my friends target blank rel nofollow title friendfeed img src http dearwendy,0
i feel like she was bitter towards people who were in upper class just because they were in upper class,3
i am still feeling somewhat intimidated but i guess by being safe and cautious and fully aware then i will be ok,4
i was in i could feel him and i hated the drawn tight feeling i had,3
i feel as if someone has bumbed my delicate set up,2
i feel just as gloomy about it at the age of as i did when i was,0
i guess sometimes you arent aware of your true feelings until a playful kiss exposes them,1
i just stayed there letting myself feel a little melancholy,0
i feel you and its so sincere,1
i feel overwhelmed they might say my stomach hurts or my head hurts,4
ive been feeling a bit remorseful about our decision kicking myself that i was too cheap for my own good,0
ive had this urgent feeling to write to you and tell you how the files make me feel but have felt hesitant because of fear as to where it will lead me,4
i need to find a way to get over this yet i feel hopeless,0
i needed a plan on how to get rid of that feeling it was totally taking over everything i am totally distracted at work with everything i m trying to do in any free time i have in the evenings the projects are taking over my life and the fact that i totally feel burnt out by it all,3
i remember hating walking from the car to the my classroom feeling judged and ugly and jeered at with every step,0
i love taking in peoples smiles the way children giggle the gorgeous way little ones move closer to their moms if strangers smile at them and they feel scared the way teenagers are boisterous and full of life and hopes,4
i wont feel so damn idiotic,0
i feel embarassed humiliated sad miserable a title permanent link to what if i have already fallen in love,0
i feel all the effort was worthwhile,1
i feel assured thankk god,1
i feel so petty who one of my first colleagues had not nice things to say about when i first asked for any contacts for investment banks from before i arrived at this job,3
i feel satisfied and happy with my choices today,1
im feeling really festive this year usually i dont get in the mood until mid december,1
im just feeling particularly obnoxious tonight,3
i feel like i was abused raped defiled,0
im zooming right through the second trimester and i feel fantastic just as i did with trinity,1
i feel and the longing i feel for is the connections i already have but have not been brave enough to complete my friendships,2
i feel empty inside like all my light has been drained,0
i believe in luck and when luck is not on my side i feel beaten and sometimes upset,0
i feel like these words from today s passage send the church of today a warning just as much as jesus was sending his beloved disciples a warning,1
i had continued to think along those lines i probably would have done the dishes in anger and when he got up wed have had a fight about that with me feeling completely abused,0
i finally fell asleep feeling angry useless and still full of anxiety,3
i honestly feel we did a fantastic job,1
i guess we all feel ugly in some sort of way,0
i feel less threatened by the world,4
i also feel a little selfish when i get excited about hitting it off with our friends friends because it makes me feel victorious in our choices,3
i aware and concerned for everyone will give attention not only marriages and deaths but also with equal seriousness to the elderly woman who feels helpless because she does not know which oven to buy,4
i feel loyal to style,2
i feel most of the time i think i look pretty cute,1
im really excited for her birthday but feeling super nostalgic about it,1
i am now feeling much more positive about her agility future because i could actually see it is there shes due her second measure some time over the next months and i would so love her to measure into small,1
im left feeling convinced this is another relationship that is damaged and it was one of only a handful remaining that i had trust in,1
i don t feel any safe,1
i could be really screwed just on waiting for a sitter so i was feeling stressed,3
im feeling pretty devastated,0
i start to feel annoyed about the whole thing and end up ordering pizza,3
i notice a lump or feel pain in any part of my body i will somehow become fearful or scared,4
i feel ungrateful and i know i feel ungrateful and i hate myself for feeling ungrateful hellip and yet i don t get that last bit,0
i was feeling listless from the need of new things something different,0
i feel lucky every single day for it,1
i feel so honored to know all of you,1
i am your friend then why do i sometime feel so insulted around you,3
i feel like sometimes i am not important at all,1
i said you are not focused with me and when you are not focused with me i feel unimportant,0
i already feel like im being tortured by not having any,4
i am feeling very appreciative tonight,1
im feeling particularly dangerous a chocolate cookie,3
i feel very excited for my familys future,1
i just really need the money right now and i feel like some greedy nasty aunt for not wanting to hand everything over,3
i feel rubbish today having a bad cold and cough really isn t ideal and the thought of attempting to leave the sofa fil,0
i loved the feeling i got during an amazing slalom run whether it was in training or in a race,5
i feel like i have to dumb myself down in order to communicate effectively,0
i might i could not stress to her how important it is to me not to expose my friends to a situation where they may have cause to feel unwelcome or uncomfortable,0
i really do feel for kids who are tortured in highschool,4
i feel pretty terrible physically today,0
i feel hopeful that we are already taking important action to make these necessary and important changes and that we will actually make an effective change and make it soon,1
i feel a little bit brave,1
im talking about stored up hurts and pent up rage at the feelings of feeling not accepted insecure marginalized and not belonging anywhere,2
i feel like a dirty heal and unconformable,0
i feel terribly helpless sometimes but even with the limited spiritual awareness that i have i am able to find the answers as i know the end is not the outcome of my decision i ll be able to move on readjust pick up the pieces re centre myself or enjoy my decision,4
i am always so sensitive and my every sense feels like it is being assaulted as i drag myself away from the darkness,4
i say nothing then i my feelings are hurt i feel uncomfortable and direspected,0
i feel an inner conflict between my sense of duty and my desire to play i hadn t entertained thoughts of sex,1
i feel that rich people will never understand the cruelty of money,1
i feel more of a sense of longing than of loss,2
i still adhere to this to a certain extent i feel that there is a fine line,1
i feel this way about all relationships romantic platonic and friend zoned friends that dissolve,2
i feel strange with the judge passing sentence in such a manner,5
i have also known the pain of feeling worthless too broken too scarred to ever span style mso bidi font size,0
i was doing some reading during a rather unpleasant plane ride the other day and didnt feel like reading unpleasant things so i skipped the uruk hai entirely and for the full reading experience should come back to it at some point,0
i feel when juggling all of the fine details that go into a professional writing career,1
i feel like my heart broke telling my children a href http twitter,0
i want to feel energetic again and when i do just that bit of exercise every day be it minutes i feel more awake energized and more focused,1
i am being selfish but i feel like me trying to make him horny is redundant because he is always horny and i feel like he should try harder to make me horny,2
i want to avoid feeling disliked,0
i feel greedy but too idealistic what is it to expect she would want you to talk to me your proported best friend that she might be happy you have me,3
i feel like i should give it a shout out because it was that delicious,1
i feel like you re being super humble right now,1
im feeling a little stressed,0
i always feel kind of thing empty feeling,0
i definitely feel like hot stuff strutting down the road in it a href http,2
i don t know how i feel about all this how i feel about my place in it if i think that my work is more or less sincere than other gen xers and so on,1
i arlovski on ufc win i feel really horrible leave a comment,0
i was still feeling strong but i missed a couple lifts,1
i consulted my aunt a doctor partially because i wanted counsel without copay but mostly because i had a feeling my doctors would be skeptical,4
i feel like she s judging me and he s not here and i don t want to seem like the needy girl so i don t know,0
i feel like an ass saying that since my sweet sister has gone through quite possibly the worst year of her life at the same time,1
i really enjoy the tone and feeling of the piece i wonder whether it would have been more successful had it been stretched out over a few days rather than just one,1
i feel im rather innocent in that respect,1
im not trying to sound so depressed or sad or heartbroken but feeling all shitty once in a while is just human,0
im feeling a little apprehensive about tomorrows weigh in,4
i havent really talked to anyone about it in depth because i feel like im being whiney repetetive and needy,0
i feel like it looks gorgeous with curls so instead of making the full transition i ended up getting extremely natural red lowlights on the bottom section of my hair,1
i feel have not convinced me,1
i didn t feel alarmed at all,4
im still feeling a bit shaken up,4
i love getting my rockabilly look on for certain occasions i love feeling pretty,1
i am left feeling like the greedy bastard and i hate it,3
i ve been feeling a bit cranky with the kids this week cranky baby whiny year old demanding preschooler so i wanted to stop and remember how blessed i really am,3
i feel proud now,1
i feel safe being a loser and this attitude is reflected in the way i live,1
i know im not in the best place of my life still dealing with the infertility issue but i feel i have a lot to be thankful for,1
i wake up and i feel absolutely worthless,0
i look pretty today without feeling vain,0
i dont show my insecurity in my persona if not i might come off as a mad bitch whod practically hated on everyone just because shes feeling insecured and being too overly paranoid,4
