text,label
i just feel so helpless i know deke s going to die and i can t do a fuckin thing about it,4
i feel today is any indication of the next week its doubtful that there will be much energy left for more than a low key new years eve party,4
ill feel to let all of these things out on this empty space,0
i now feel as if im doomed to fail my upcoming global regents,0
i are another reason why foreign tourists feel reluctant to drive in this island,4
i hate seeing those red windows even more as what i feel inside resonates with the cold uncaring world i know exists behind them making me even more aware of this pain inside of me,3
i feel ugly i look ugly,0
i had this crazy idea that all of that water slogging around in my stomach would make me feel crappy so i kept my sips to an absolute minimum,0
i had been indifferent to tell the feelings and words i had treasured ever since the feeling start to bloom are one of the moments i want to keep,2
i feel like your child is worthless even though they passed the assessments better than anyone who applied with a college education,0
i am sure everyone of us felt that feeling at least once while some of us might get agitated easily,3
i feel drained after being out and about even if ive enjoyed myself,0
i simply said how sorry i am and just got out from her car and got into my house feeling restless,4
i am feeling cranky today is due to me not getting enough sleep due to the unexpected long outing yesterday night,3
i feel extremely needy though i dont feel this way too often,0
i remember consistently feeling dissatisfied with my progress,3
ill let you in on a few more huge dieting secrets just because im feeling very festive and giving right now,1
i feel confident that my prayer will be granted,1
i bought myself a make up palette two months back post and today i bought items and im feeling ecstatic,1
i can t help but feel considerate towards others,1
i drink into my feelings get numb,0
i prep myself for another sleepless night i can t help but feel ashamed of myself for feeling this way,0
i remember feeling very very violent and very disgusted the oscar winner tells access hollywood,3
i feel a longing for the obsession,2
i feel heartless now feeling bored and not believe in love anymore,3
i feel that i have got my looks and sweet nature from my mom,2
i remember feeling dismayed from this observation,0
i feel so pissed about myself,3
i was happy with the progress but i was also beginning to feel a little hopeless,0
im not emo ing no no no haha i am feeling happy instead for being able to meet up with them,1
i feel shaky dizzy and my stomach starts to hurt if i miss a meal,4
i was feeling grouchy and everything for the past few weeks but yesterday was such a happy day,3
i will always wake up feeling miserable and heartbroken,0
i felt out of control i hated myself for feeling it then felt more out of control hated myself for hating that i hated it and it just got worse until i was walking to work in a haze trying to not curl up on the pavement and just,3
i am this evening having had a brilliant night fantastic run and feeling jolly darn good,1
i feel sort of foolish it was actually very easy and what she was asking made complete sense once i got there you have to bind off the neck and work with the shoulders separately hence the need for two balls of yarn,0
i feel like a worthless ugly fat unattractive piece of shit,0
i barely seem to remember where i live in the middle of coming to terms with the likelihood that i would just be single for the rest of my life and feeling pretty content about that,1
i feel determined to give this process a label,1
i have to admit i was feeling pretty horny nicole,2
im really feeling hot comfort foods this week,2
i almost fall asleep but i feel so awkward sleeping beside her,0
i came home and enjoyed minutes in the garden feeling the lovely warm sunshine on my face,2
i have spoken to are so pleased with the facilities often feeling really valued for the first time with their needs being properly recognised and properly met,1
i dont understand why i feel so empty and hollow deep within me,0
i just feel resentful and show my resentment by eating tempura and sundaes,3
i tell people it feels like i am trying to convince people i am innocent but no one believes me,1
i concentrated on the smell i started feeling it and knew it was the nostalgic aroma of my grand mother s home back in bhubaneswar orissa,2
im feeling quite cold actually,3
ive been slowly working on my london zine but havent been feeling super inspired,1
im feeling thankful for books york peppermint patties finding a roommate this year who has become a very dear friend of mine blake,1
i felt empowered telling him how it had affected me how i had come close to suicide because of the severe distress it had caused me to continue to feel long after the unpleasant encounter where what i felt was disregarded completely,0
i had a very provocative dream the kind that makes you feel slightly shaken as you wake up from it,4
i do when i feel lethargic,0
i feel a whisper a friendly voice start to rise indulge until your hearts content and pay no mind,1
when i saw my family after a separation of one year,1
i feel awful everytime ac,0
i feel pressured to say something,4
i think i m a bit better today although i still feel like i ve been run over by a truck and the cough is being remarkably stubborn particularly when i try to speak,3
i feel like a little kid whose mom is proud that they touched the soccer ball once during the game,1
im gonna stop him from bugging me and get a license yes feeling very very determined right now insyallah by end of next year,1
i fully enjoy music when i feel afraid using headphones,4
i feel that im much more productive i get less distracted and i feel so much more accomplished,1
i do feel agitated restless or on edge quite often,3
i feel exhausted just by writing that,0
i feel for all those who lost their homes those without power and all from this last bad storm,0
i stayed under the freezing stream maybe a few minutes longer than i would have otherwise enjoying the feeling of water over my abused body,0
i picked up feeling a little apprehensive,4
i feel so unimportant which im probably am,0
ive been told this is normal his last reading was he feels and looks horrible,0
i starred into susan s gaping cum filled ring i could feel my own cock hardening in the vain hope of fucking this goddess myself but that would have to wait another day,0
im glad i have a god with whom i can feel safe,1
ive hated pretty much every shampoo ive tried without sulfates i often feel they make my hair look dull and produce pretty much no lather i need bubbles,0
i feel ashamed and embarrassed every time someone is executed in the us,0
i think too much about how i sit how my voice sounds if i ve gotten any food on my mouth and the feeling that i need to make my way around to everyone so as not to be rude,3
i am crushed and think of suicide but i will not ever ever give up on my kids i will fight and prove her psychotic behavior to everyone she has noconscience and feels joy to hurt me but i will prevail,0
i search search search and very rarely feel satisfied with the solutions found,1
i must confess im feeling a little overwhelmed,4
i finally got tired of feeling like no matter how smart or well educated or determined i was i was never going to get ahead in vancouver,1
i look around at the people around me and i feel almost slightly envious about how they have a way of motivating themselves sitting down and studying so hard,3
i was afraid of feeling helpless,0
im here today after looking at my bank account this morning and feeling shocked,5
i feel so strongly and passionate about so hearing that just made my heart sink,1
i open the file im interested in and for about twenty minutes read fiddle and wonder why im not feeling creative,1
i enjoy feedback and love comments on my posts so please do not feel afraid,4
i feel after a horrible winter,0
i feel you know basically like a fake in the realm of science fiction,0
im feeling quite pleased with myself i spent minutes on the cross trainer and then two lots of minutes on the vibration plate just to test out the programs of course,1
i think it to want you to settle immediately each other not to feel unpleasant,0
i guess this isnt a very exciting story but it really meant a lot to me and made me feel less crappy about my job and less fearful of the strangers of this world because some can actually turn out to be quite nice and quite funny,0
i just grab something and hit myself just to feel pain damn i know the risks and injuries that might occur i know its dangerous,3
i feel contented staying grounded and take it slow as i build up the little things that comes my way,1
i could loose my job i would be so f amp ed for xmas i hate xmas i hate holidays i wish they would go away i feel nervous i feel sad what if i disappoint my family my friends,4
i are both aware i have many personal reasons to feel less than fond shall we say of your prince and i suppose it s only human of me to wish to make that point abundantly clear to him,2
i get to pursue things that spark my curiosity and make me feel useful,1
i can be surrounded by a sea of people and still feel all alone,0
i feel a little suspicious,4
im feeling kind of lonely right now even though i just talked to jack sarah and a lot of my other friends,0
i come out of the cinema feeling like a giggly schoolgirl,1
i personally feel amazed that i have managed to connect with such amazingly talented and creative people through this little world of dance,5
i hope that the next quote will be able to let my special someone knows what im feeling insecure about and understand that no matter how much i trust,4
i could feel this way but i honestly believe that he was and is a very violent and dangerous man,3
i dont i feel amazed,5
im being accused of feeling superior to the characters its usually by people who themselves feel superior to others,1
i feel them gnawing out holes all throughout my flawless soul,1
i hope to always remain grateful even when feeling a little unsure about my endeavors,4
i feel really bothered,3
i pray the rosary i feel a sense of calm upon me,1
i feel very bitter that i am supposed to be providing this privileged space to someone else and i dont get it,3
i feel nervous i dont feel super confident that i have it until i have the trophy,4
i listen when he tells me he has an ominous feeling but i ignored him this time because i so wanted to see what was down the trail,0
i homophobic men repressed homosexual feelings paranoia projection a tragic story how dangerous sexual repression is,0
i was impressed with how dunham portrayed hannahs whole experience from trying to deny that its happening to feeling offended when you feel like someone is trying to minimise the distress its causing you,3
i feel very disheartened today,0
i just remember feeling frantic desperately trying to say what i needed to say to q,4
i cant help but wonder if the other mom i walked with felt the same way i was feeling as she watched her sweet girls with my isaac,1
i along happy peaceful feeling fantastic,1
i feel that i need some divine direction in order to move forward with the things that god has called me to do,1
i feel a little bit more vital,1
i can feel my stomach aching and grumbling,0
i love earning money and having it but because i grew up in a lower middle class family i feel very appreciative of the money that i do have,1
i walk by those temptations i feel disgusted,3
i once told my friends that i feel like doing some sort of backpacking but instead of supporting me with this idea all i got from them were raised eye brows and some sarcastic remarks,1
i left feeling pretty disappointed in my casting skills,0
i look at him and say nicely and friendly well im sorry you feel that way i do apologize to you this angered him more and he stormed out saying i dont need this shit not a good night overall but im off till friday thankfully,3
i am actually feeling optimistic about my back and my future in movement,1
im not feeling all that happy or thankful today,1
i feel the word rich is accurate to describe texture and color payoff,1
i feel impatient with the christian church disciples of christ and its many manifestations over the fact that i haven t yet gotten even the slightest whiff of a call,3
i feel my own heart a lot to make sure i am still there,1
i am feeling reassured by this a wave of missing hits,1
i would have never understood or valued the meaning of a life partner if i did not feel lonely,0
im feeling much more positive about the impending move,1
i had to cut the lines to make it fit making it sound a bit rushed lets all make believe that that rushed feeling is actually a frantic feeling that was entirely deliberate shall we,4
i feel listless and completely unmotivated to do anything but i will bake some almond poppy seed bread and make a pot of chicken noodle soup in an effort to be less than useless today,0
i feel students need compassionate strong and dedicated individuals who embrace the role of luminary with humility and a sense of adventure,2
i still am not able to remember a single dull moment a detail that pissed me off a thing i didnt feel comfortable about,1
im left feeling paranoid and like it keeps getting harder to feel happy,4
i feel carefree and young and amazing,1
i never thought i would feel more passionate about anything until i began teaching,1
i just feel so useless and utterly worthless,0
im feeling kind of dumb admitting i was gloating over the fact that i had her now,0
i would also hate for you to feel i was selfish in my decision,3
i feel that sweet potatoes are very under rated,2
i feel so helpless because i dont know what more to do,4
i feel an honor of my content being there,1
i suppose that is enough of a statement for those who might feel as i do about his contribution to the unfortunate attitude and rhetoric of conservative christian america,0
i forgive myself that i have accepted adn allowed myself to feel uncertain and inferior the moment someobdy is looking at me as i do physical labour,4
i havent had dinner but im also feeling pretty lethargic so im not sure thats going to happen at all at this point,0
i watch hgtv and i feel like im not that talented,1
i finally admit im feeling sorry for myself evar ok i finally admit im feeling sorry for myself if bc,0
i dont think thats what ill do because i feel its just really awkward,0
i have succumbed to the dreaded commuter virus and feel altogether a little bit rotten,0
i feel like you feel this is a mistake but time is fucked up sleep won t take,3
i feeling so miserable when actually my mum should be the one feeling miserable,0
i want to feel groggy and heavy,0
i had always dreamed of doing and it was a good feeling a fantastic feeling to be able to give them this,1
i can t help feeling jealous,3
i feel exhausted and just want to be taken care of,0
i realise my thoughts feelings emotions reflect my acceptances and allowances as a result of accepted and allowed programming and conditioning through and as time,1
i flung into my suitcase at the last minute didn t break on the crossing over or explode in the pressurized cabin so thus far i m feeling pretty splendid about things,1
when my last years second semester results came through i was ecstatic,1
i feel as weird criticizing this game as much as i feel weird praising it,4
i feel hated loathed,0
i know there are times where some nightmarish things may really happen to us but when dreaming bad visions just popped into our minds and have us feeling terrible,0
i feel like i m always stressed worried or upset about something,0
i feel like im living my life through all the romantic teen movies i watch,2
i feel superior because i actually know who their president is,1
i feel too disillusioned to hope for anything,0
i nuh must feel joyful and victorious,1
i can make and one that i feel i am called to make to my sweet jesus who sacrificed everything for me,1
i could do was feel i felt thankful that her battle was over thankful that she was now in a place of serenity,1
i set my mind to wanting a specific item needing it for a specific event or at a specific time i find ill end up spending more than i want to because i feel pressured by constraints,4
i feel smart and i want to show it off,1
i feel as though canadians are coming complacent with the workings of our country because of how well weve fared in the recession,1
one night,1
i got to feel that kind of joy was during college and even then i was still caring for others providing for others and just generally being elizabeth,2
i feel selfish for that choice i made i just beg that you dont let your love for me go away,3
im feeling horny right now,2
i was feeling at the start didnt want to move much at all was really glad to experience this glimpse into the sort of vibrant energy i will gain through out the year,1
i feel a bit jaded and weary of the world,0
i go to the gym i can t even get my heart rate high enough to feel satisfied thanks to the level of competition i ve experienced in the past couple of years,1
i always feel like im entirely pathetic and needy but those people usually tell me that i was neither just quieter than usual,0
ill be attending college classes and ill have a bunch of stuff to tell you guys about like how classes are going and how im feeling and if i meet anyone cute or not,1
i am feeling somewhat melancholy over that,0
i feel lucky to know what its like to revel in the freedom and wide open spaces that being by the sea affords,1
i like to slump into when i m feeling precious,1
i feel bitter and jealous,3
ive come home for the holidays i feel so much more mellow,1
i feel very weird about so much of my psychological safety coming from noah providing money,5
i suppose to feel terrified,4
i feel wronged by you over and over,3
i doubt anyone is if they are entirely honest with themselves and thats ok because for now i may not feel perfect but i do feel happy and thats one hell of an improvement,1
i also feel like i was being way too irritable today,3
i feel really pathetic confronted with some,0
i am feeling quite pleasant,1
i grabbed my shoes no socks too lazy and got on the car and the teacher greeted omg she is so nice i feel really bad,0
i feel sorry for them,0
i feel idiotic sifting through personals sites only nerve,0
i feel so passionate about utopia is my desire for peace on this troubled earth,2
i cherish that feeling of babies asleep on my chest their amazingly sweet breath and the feeling they give me of i am needed,2
a certain friend tried to push me off a seat in a very violent way for no apparent reason it may be that he was excited about something,3
i feel so blessed that we were privileged to go,2
i would watch him and feel frustrated he didn t realize that fifteen feet away was the ocean the freaking wave crashing covering the majority of the earth ocean,3
i feel a little calmer im more irritable and impatient than before,3
i feel greedy with my thoughts and it is a relief to let them linger,3
i feel he should have been punished,0
i kind of wish i had come up with those thoughts myself rather than feeling the way i do now a lame disciple merely about to regurgitate eva s thoughts on to you all,0
i were any sort of poet i am convinced i would be sucked in to the romantic literary style and simply write for days about the turning of the leaves the feeling of the cool wind with the warm sun,1
i don t really feel all that bothered by it to be honest,3
i felt rich being able to insist on paying more than the asking price the shop assistant was obviously pleased at being able to boost the takings for the charity and i hope the generous person who donated the easel to the shop is also feeling rich,1
i really love the feel of these lipsticks and these colors are really gorgeous,1
i know how it feels to find someone who is irresistable and remain innocent,1
i caressed it affectionately and she curled up ever so close to me giving me that wonderfully warm feeling of divine mother s loving sparsh which i cannot forget,1
i read that men would rather feel unloved than inadequate or disrespected,0
i feel depressed to the point of developing high fever at least once a week,0
i am just so sick of feeling hated and lonely and dumb and unloved and forgotten,3
i have a feeling my mom wont be so keen on that idea,1
i feeling confused with my life and want to know why my life,4
i feel content just because of the weather,1
i feel like throwing away the shitty piece of shit paper,0
i thought wed escaped the interminable bouts of bods in dressing gowns feeling each others lapels we now have the charming spectacle as i type of a guy in a tight fitting deep blue combo trying to for all intents and purposes take another guy in red from behind,1
i wish we could have a huge collective book club about it because i think these conversations are critical during a time when people are feeling increasingly fearful unsettled and disconnected,4
i am feeling very shaky,4
i feel depressed i feel like they would ve been negative because i hadn t been the most influential big brother,0
i wanted to avoid feeling rushed,3
i don t feel the least bit left out instead i m eager to watch these two as lucas grows,1
i feel a bit sentimental,0
i am slowly paying off my debts and i feel generally happy about where i am and what im doing,1
i was feeling playful,1
i feel really lucky to be part of what looks like an active and friendly homeschooling group here in dubai,1
i won t get into making excuses for the man he s a big boy and can do that for himself and his staff i walked away from red rooster feeling dissatisfied underwhelmed and confused,3
i often feel like im drowning as i try to come up with valuable content and write engaging posts,1
i struggled with feelings of anger hurt and sadness yet i still felt hopeful,0
i now know how many muscles does the body have because i can feel each one of them aching,0
i walked away from the weekend feeling simply dirty like i had done something really harmful and this feeling more than anything is what overpowers my feeble attempts to justify my actions last weekend,0
i feel distraught as ever,4
i didnt feel like suffering through a sleepless night especially with my terrible allergies amp amp fever,0
im feeling to what im watching and reading beware here be spoilers and music that im loving to listen to,2
i did however feel amused that she also called famous last words cathartic i think she s one of those people who secretly likes mychem but can t admit it for fear of damaging her music cred,1
i refuse to stay in this place we all have moments of feeling exhausted from very hard work and needing some validation in return,0
i feel about colors shades needing to match exactly so i am very thankful for all the time she put into making everything exactly to my liking,1
i hate the moment when i completely feel perfect with people around me whom i love the most suddenly disappear,1
i mostly feel this as a cause of hateful memories of that girl who used to run the everchanging sailormoon gateway who i think is still making a name for herself by being stupid and mean,3
i feel so vulnerable to criticism like if my lunch stinks or if somebody comments on what i eat i have this embarrassed feeling,4
i leave the nursing home each week feeling so joyful and ready to come back again,1
i feel i am so strong enough to take this pain thinking how you did me wrong,1
i left you i was feeling pretty defeated,0
i always feel boosted spiritually but totally drained physically,0
i feel blessed and lucky to have gone so many places and seen so many things,1
i feel like im in with the cool girls but that theyre just tolerating me because im paying them,1
i feel horrible and i would prefer to extend my deepest sorrow rel bookmark permanenter link zum eintrag,0
i hope you can feel the presence of loved ones right by your side cheering you on and wanting the best for you cos youre not on your own you never are d,2
i feel pathetic at times because,0
i am skinny look at me i am thin i love myself but i am feeling ignored i am thinner now i try to disappear,0
i then feel like a hopeless case beside them,0
i dont have to know how or why all i know is that im building good habits without feeling deprived in any way,0
i feel pretty pathetic as an intercessor,0
i say no i feel guilty img src http var,0
i also love this one but will be able to send it to a good home without feeling like i m giving away a vital organ,1
i don t feel as smart or impressive,1
i feel selfish thinking this way but i feel so lonely at times,3
i havent felt like posting in such a long time but i feel more sociable now,1
i feel like at the moment with all the things to do and worry about and organise and because he is so supportive i have let myself forget to give him the attention he deserves,2
im feeling lethargic these days hence the long hiatus,0
i feel funny about mothers day,5
i write when i am feeling happy and childish,1
id be less than honest on this blog if i didnt report that im feeling very petty right now,3
i got s and really i feel like i hit the lottery i was scared itd be something like x and id be screwed,4
i feel honored that you accept my invitation,1
i feel but distressed is sufficient,4
i feel i am really teaching and students get some lovely finished pieces,2
i feel privileged to call them my cousins,1
i have my best most productive happiest days when i m feeling inspired,1
i want to take a shower without feeling like i was beaten with a baseball bat,0
i feel virtuous because all day i have cleaned a house that needed the mopping and tidying,1
i was feeling so carefree and wanted to go and have some fun,1
i was buying clothes that made me feel uncomfterble just so i was accepted,1
im feeling pretty energetic,1
