text,label
i want to say how i want to feel just come out so bitter and angry,3
i am feeling very apprehensive about the future at the moment,4
i feel so terribly that i have ignored her sweet email up until now,0
i was feeling grouchy and all,3
i actually feel like everything is going to be ok,1
i forgive myself that i have accepted and allowed myself to forget that i decide and thus i was decided to feel groggy this morning,0
i feel so much more myself and i missed me,0
i feel like all the unsuccessful endeavors in my friends lives are my fault,0
i was left feeling foolish all alone in the rain,0
i feel groggy and want to crawl back into be with my cat and my book,0
i like doing leaving me feel inadaquate under valued and under appreciated,1
i guess his widow was feeling generous when she packed it up,2
i feel like weve been doomed from the start and yet were still together two years later,0
i feel more stressed than ever,0
im feeling emotionally vulnerable right now and just want to throw up in peace so i can go back up and party hard,4
i was feeling generous that saturday morning and told them to go ahead with their plan to have the stand and if they made enough money id take them to the theater to see a movie,2
i feel it must have been the violent dream i had to snap myself awake from a difficult dream of my mother representing anyone and everyone and self violence universal but beautiful in its metaphor,3
i only have a couple of things left to make and at the start of december i am done and feeling smug,1
i am feeling a little dull this morning because we had a winetasting at our apartment yesterday to choose the wines for our wedding,0
i was sick of feeling so lethargic all the time,0
i feel like my day starts around lunchtime which kind of feels awful,0
i still feel the pressure to make sure they are excited by what santa brings,1
i feel more in control and less frightened about my headaches and migraine attacks excellent service,4
i feel wholly and completely loved well most days,2
i got the feeling watching it that only from starting out by making hats for his school friends could one develop such a clever use of resources train tickets doc marten soles barbies and shattered mirrors to name a few,1
i threw myself at him after all feeling genuinely pleased for him,1
i feel very irritated and annoyed today,3
i feel that even though some bloggers are popular within one clique there are twice the amount of people who are jealous of their success but chooses to kiss their butt to fit in and triple who disrespect them for their pompous notoriety,1
i still feel a bit stunned and i suppose i should be racked with regret and shame,5
i hate to feel threatened totally,4
i am sure that fans of every other team feel one of their guys got slighted and in the long run it really doesnt make much of a difference its just a shame that someone as talented as evgeni malkin was left off,1
i feel like life is too good to be true,1
i feel honored to wear usa on my back,1
i struggling to find a common ground with not feeling deprived managing my stress and activity and living a healthy lifestyle,0
i feel the cold more than him,3
i think this will help somebody out there that feels hopeless and alone,0
i feel so helpless but so well protected,4
i took to be his son joined elihu and me at christmastime inside a fine home with lovely mill work darkly lit and with a large stately christmas tree in the living room the feeling was gentle it was one of long lost friends meeting for the first time as adults as people,2
i am a good person or that how i feel is acceptable or somehow normal,1
i feel like i got in at that sweet spot before everyone realizes how messed up everything really is,2
i feel like mike is loyal and will always be loyal,2
i feel that he wasn t making the effort to see me i blamed it on an over active imagination,0
i wish i have the feeling back soon cause now i realise how lonely when i dont have the feeling its like soo unwanted even when i am not,0
i can feel the frantic beat of his heart but cookie s voice is surprisingly clear,4
im hesitant to make suggestions because i feel as if the outcome would not be sincere,1
i just feel so overwhelmed by the feeling of balance that i just,4
i become more comfortable in this remodeled office i am feeling much gratitude for its wonderful amenities,1
i was feeling paranoid tonight so i had to check my blog stats,4
i feel resigned to my lot in life being that i watch everyone else become a parent,0
i had been feeling extremely homesick the first two days,0
i feel sorry for those that can t eat mangoes amp grateful i can,0
i have had the luxury of expressing myself and my feelings without the fear of getting beaten up or scolded,0
i friends its a feeling that runs under everything he is every dumbass word he says and moronic thing he does but its worst when hes with rukia,0
i was not going to be able to sleep until i knew how it ended and mostly because of another thing which i am not even going to talk about here because it makes me angry all over again and also because i feel horribly neurotic and immature getting upset about it and so we will gloss over that bit,4
i feel kinda strange too cause i didnt encountered with such feelings last year,5
im starting to feel less like i have a cute little bump and more like i have a bigger belly,1
i just don t feel like having distraught parents breathing down my neck,4
i specifically wanted tango was feeling shy and maks quite the opposite hard to get far enough away from him to get good pics lol,4
i duno i feel as if im doomed for ther rest of mi life,0
i feel a creative mind brings more diversity and new thinking to any job,1
i feel inside or how that creative person seems to be gone,1
i hardly feel like i had a weekend if i dont get fucked up,3
i have been anticipating so i am somewhat surprised uncertain and to some degree annoyed about their presence in my daily experience especially in light of the fact that i have at other times been feeling more joyful and confident in my abilities as a loving human being than ever before,1
i started to feel a sweet feeling of peace,1
i got home feeling exhausted and discouraged,0
i remember feeling overwhelmed and noted the particular smell off the city mostly cigarettes and people with wafts of charred something,5
i feel funny without,5
i feel curious about all this things around,5
i just feel humiliated and stupid that i didnt realize that all these things were only pushing you farther away from me,0
ill talk about the feel of fake products and places i trust to shop,0
i understand that you re feeling anxious,4
i also feel proud of her,1
i will feel as though i am accepted by as well as comfortable being around both sides of my family,2
i hope mine goes well again because at the moment i m unfortunately feeling a bit resentful with the aftermath of the holidays,3
i m filled with astonishment and feel amused about what this city has witnesed today,1
i suddenly felt how statesmen feel when mobbed by the press or how doomed men feel right before they are lynched or stoned by a mob,0
i feel so shitty right now i just arugh,0
i have a feeling that its something ive missed because it shouldnt be that tedious,0
i feel a violent urge to vomit and back out of the room,3
i am supposed to go about being strong when i feel so inhibited,0
i also feel its a transition piece for me still sweet and classy adding that touch to my more goth punk rebellious style im falling into lately,1
i feel a satisfied calm while recording a dream that i presented it like the higher message in which it was intended to be,1
i think if youre sad a top tip is to eat lots and lots and lots and lots of it until you feel very satisfied and a maybe a bit queasy,1
i feel as if i was abused in some way,0
i feel horrible for people whose babies accidentally suffocate from blankets and stuff because the guilt must be terrible but in a case like that it was avoidable so its more frustrating than anything,0
i also feel much more triumphant while doing homework reading,1
im destashing a couple cuts of fabric that id bought to make clothing and it has just sat around feeling unloved,0
i run to him when i feel threatened and insecure,4
i sit here to write i start to dig out my feelings and i think that i am afraid to accept the possibility that he might not make it,4
i sure know where to come if i m feeling a little tender,2
i feel out of generous love people have focused too much on my story and i don t want to perpetuate that dynamic there are some other educators who are going through the same,2
i am feeling a little stressed as aaron has friends over for a sleep over,3
the time when my sister had her first baby i was so happy and joyous because she stayed for two days after marriage before she had a child,1
i feel stressed tired worn out out of shape or neglected,0
i quit my job in financial services feeling disheartened and disillusioned and i took a complete u turn in my career returning to university and studying something very different from what id been doing in my job,0
i am feeling quite pleased with myself as this was something id never done before,1
i did restart my gallery but only because i was feeling very vain and gorgeous at the time,0
i feel ashamed youre perfectly fine granting,0
i feel so lousy and useless in my class,0
i am feeling a little groggy this morning not to mention a headache,0
i feel fucked church of fuck luminaries swinelord are back with a deluxe r,3
im feeling more fucked up than ive ever had and its nothing to do with my school work,3
im so overwhelmed with feeling blessed by you i have to pray the fears of this being the last time i say happy birthday to you,1
i think people reject their feelings because they re terrified of them but the truth is that once you see that you can t die from them and that they actually go away they re not so scary,4
i made a shocking discovery that made me feel incredibly dumb and to which i of course feel the need to share,0
i feel very privileged not only in being able to share in her artistry but knowing she has my back,1
at school,3
i feel one with everything i meet even here when i return to this body out with you my beloved father indeed am beginning to realize the meaning of that unearthly love which i have sought for so long,2
i really wanna see her soon but i feel really needy for asking her if i can see her,0
i basically feeling a bit grumpy most of the time coz i was hungry,3
i feel generous sometimes and feed a little of those savings to the birds,2
i see a family of swans i feel joyful and peaceful and blessed,1
i feel stubborn and strong and ready to fight this disease,3
i feel a strange connection to them a familiarity that most of the time i link to ancestral memory,5
i feel devastated disgusted and betrayed,0
i feel like a greedy little traitor i m looking looking among these covers hey little snotface take me,3
im getting ready and feeling stressed in general all take a toll on my milk supply and im not producing as much,0
im personally happy grateful and embracing each moment but i feel that my patriotism is being abused,0
i apologize to anyone who may feel i have been a neglectful slacker mcslackerson,0
i feel very angry and upset with my customer,3
i feel like amazing x men compensated enough to earn it a out of,5
i feel like i missed out when i was younger but i was very active and would be much more content to go outside and ride a bike,0
i entered the temple feeling vaguely terrified,4
i feel so agitated about this,4
i am going crazy at leas the feeling is more pleasent them fearful,4
i never feel ecstatic or bouncy or anxious,1
i am not sure if we should buy more but my hubby and i are feeling pretty impressed,5
i dream i feel like i am finally not burdened by all of the things that i feel just crushing me when im awake,0
i don t know how it works but asking for divine assistance certainly makes us feel more graceful even when our situation remains the same,1
i feel heartbroken one middle aged woman told pyongyang s state run media,0
i feel that barker is successful in showing the horrors of world war one,1
i feel the wrapping of the gift is almost as important as the gift itself,1
i really want to go buy some yardage of art gallery just to play with because it feels so amazing,5
i feel innocent and free again,1
i hope for is that those certain people can attend to more important things in their lives but still come back to blogging if they feel they missed blogging,0
i feel surprised when i looked new,5
i know just how you feel any ache pain in tummy i get frightened incase it em again,4
i am feeling discouraged it is,0
i know takes a lot of present moment awareness and part will be the challenge of accepting things as they are so i don t set up a feeling of wanting or discontent,0
i glimpsed a visitor but i could feel it was disturbed somehow whether mad or confused or something similar,0
i feel like this leads me to be not as gentle and kind as i should be,2
ive lived too long feeling shitty being picked on and feeling like the odd one out,0
i feel that s the one thing i ve enjoyed about tv people have the time to be shocked over kenny powers and then you have time to let go of it and love him later on,5
i feel quite jolly in spite of the heat and the lack of commercialism,1
i may notice that you feel aggravated or joyful or whatever it is that youre feeling,3
im afraid that if i do that and he doesnt have feelings for me our working relationship will be irreparably damaged and i may lose my job,0
i am energetically pursuing my goals or i feel agitated and unable to sit still,3
i want to exhibit all new pieces which is kinda making things a bit more stressful but i know id feel somewhat dissatisfied about showing old work,3
i think i agree but it does give me an extra measure of humility when i feel really stupid,0
im sure it feels wonderful,1
i write now it feels like furious abandonment to embrace a cliche,3
i really feel cute when i wear them,1
i am really worn out today and feel beaten down,0
im feeling a little melancholy as i listen to this song,0
im going to sleep now while i still feel triumphant,1
i feel but i m trying to be stubborn and ignorant at the same time so that i can keep going,3
i do not feel disadvantaged because i believe that as long as there is humanity in the subjects there is a potential for communication and the sharing of ideas and a potential to find a common ground in language,0
i got to feel something so amazing and powerful that made me feel an incredible sense of happiness and contentment that i did not believe existed,1
i feel even if he killed himself it was because he was agonized to that extent,0
i feel more crucified heartbroken tortured and forsaken than i have ever before felt but not at the hands of my enemy at the hands of those i love,0
i can feel myself slowly uncoiling from the fearful place inside and enjoying the time as i hope he can enjoy it and starting to actually swim around a bit rather than just walk in the water,4
i settle in other ways based on feeling worthless,0
i literally just text tychelle to see if she wants to hang out because reading what i just wrote about my nonexistent social life made me feel so pathetic,0
i keep in the fridge and take out whenever i feel too hot spray on my face and it cools me down immediately let alone it smells like oranges,2
i am bloging again i am sitting here feeling content with my dogs amp cat etc and i know that how lucky we are the truth is we,1
i was hoping by then i would feel ok,1
i was feeling beaten up by life yesterday you see i am in love with a schizofrenic man who i had to kick out of my house for having boisterous fights with himself,0
i feel like they just feel guilty for treating me badly and i dont really want to go back as i wont get on the league proper anyway due to my inability to make every practice and service hours despite being a very good skater and having a good attitude toward the practices i can make,0
i admit that with all the thoughts that go through my head i feel doubtful at times coz im scared,4
i have carried around an audre lorde quote that i often refer to when i am feeling fearful or uncertain about things when i dare to be powerful to use my strength in the service of my vision then it becomes less and less important whether i am afraid,4
i often feel real gloomy theres always another large government program on the horizon our freedoms are consistently contracted our wallets are pilfered for the benefit of fat cat corporate bankers and the public continues to vote in the politicians who steal from us every day,0
ive been thinking about it because recently theres been times ive been overwhelmed with gratitude to the point of tears and other times im thinking about it because im im feeling so incredibly ungrateful maybe also to the point of tears and wondering why,0
i feel a little sad about it but christmas is hardly on,0
i started to feel kind of skeptical about this myself,4
i have a bad feeling about something that should be respected,1
i was way up ahead of raphael and laiya jennifer had stayed behind to watch our stuff since i was feeling particularly energetic and scampering up the mountain,1
i will definitely write more about the transition as i go through it but right now i am feeling quite positive,1
i feel so honored that they enjoy it enough to create with it,1
im feeling disgusted already but seriously though i dont really like to have my pictures taken cause ive always referred to myself as ugly,3
i am feeling genuinely proud of myself,1
i just feel very dull right now,0
i only need to feel respected and safe,1
i feel privileged and honored to be able to represent my college in such a prestigious event,1
im still not sure why reilly feels the need to be so weird,4
i feel fab if i can get hours sleep in one go but sam doesnt always oblige,1
i feel disrespected as if those of us who are so loyal to our relationships simply do not matter,2
i feel reluctant to join the class trip to beijing,4
im not going to lie i feel a little insulted,3
i was like oh thats awesome blah but then he was like reminding me hes interested in this other girl and i was like i know this but what concerns me more is if it makes you feel too weird to be with me like this,5
i might add that i feel dismayed whenever i see christians posting links to such apologetic drivel as my online friend did because it only acts as a disclaimer which boldly advertises their own stupendous ignorance and incredulity,0
i just feel really lame,0
i think since im compelled to act all meek and asian in front of my own kind i feel a tad inhibited to the extent that i cant even be myself,4
i feel too selfish to talk about you to anyone else thyroid for i do not want them to think i am just dramatic and whiny when really it is just hard for them to understand that yes someone can look fine and still feel terrible,3
i express my true feelings about such a wonderful experience,1
i miss him and for me the fact that i have that feeling of longing to be with him again is actually a blessing,2
i feel as though i am being a little neglectful of my fellow bloggers,0
ive turned it on a bit but its feeling very casual,1
i feel carefree and weightless and yet worried and grounded all at the same time,1
i have a feeling david is going to turn out to be a terrific father hes already exposing his newborn son to the world of the geek,1
i was trying to be a friend to him so that he wouldnt feel rejected by me,0
i feel like we are supporting her lifestyle,2
i was feeling rather playful last night as well,1
i could feel my tremors coming on and i started to get real shaky,4
i also feel that too much content is contained in the vocref top ontology,1
i still have that feeling to you until now ya the feeling to loving you,2
i feel pretty virtuous about it actually,1
i feel very pretty and i have a really cute outfit on with some pretty costume jewelry,1
im not feeling homesick yet so im feeling alright about this,0
i feel very reluctant to have to walk through,4
i feel ignored i feel this boredom like a little sword straight to my chest straight to my chest to my chest to my chest straight to my chest straight to my chest to my chest to my chest straight to my chest straight to my,0
i feel privileged to be there at this very real and intense time,1
i think about it how harmless that insect is i feel pathetic to be so overpowered by fear,0
i guess when you are constantly feeling unhappy around the person it is a sign to you to remove this person from your life,0
im good at hiding my true feelings or blurting them out in sarcastic tones,3
im trying to be intuitive often just makes me feel sort of confused and nauseous,4
i looked at what had happened to us in two generations and looked at what hadn t happened to them in two or three and instead of feeling outraged by their history of aggression i felt privileged by it,3
i feel like i cant take it anymore i told my boyfriend and he is furious,3
i feel like i ve been neglecting my beloved mom blog,1
i feel those memories are precious and i am so glad i have them,1
i stared up at him amazed by the feeling and as equally amazed that nothing else was happening,5
i feel lucky to the point of feeling guilty about having got away without more serious damage and disability,1
i made it to work but i am feeling a little groggy,0
i feel fantastic now but am terrified of injuring my back again we provide our sizes for the following items,1
i did it i survived our very first big kid trauma though i still feel shaken by the whole event,4
i first got my eye infection i have to back up and if possible make you feel less sympathetic for me than you probably already do,2
i thought that was the end of it but a few minutes ago i got off the couch and felt so hot and sore and soft yknow when you have a fever how your body just feels really tender,2
i want to push myself to think more in terms of discipline and what is a pro goal and pro me choice and not immediately default to feeling deprived,0
i hate that feeling when im about to do something then i get scared and almost turn around and walk away,4
i am yelling at my kids at the drop of a hat for no reason possess no energy to do anything just feeling irritable and sad about everything,3
i look in the mirror these days i do think i look pretty but i also feel like i look boring at the same time,0
ive been feeling a bit disheartened blog wise recently,0
im not feeling obnoxious with myself anymore,3
i feel tortured by my self inducing deprecation and resentment,4
i would just go to the straight point rather than doing a defination of such as what is romance feeling or anger feeling or suspicious feelings,4
my cat died from an illness it had been with us for years it was a lovely cat it had been ill for one or two weeks and the veterinary surgeon had told us that it was dying,0
i really feel that we are progressing towards a society that is more fearless incrementally throwing away seemingly rigid boundaries like paranoia over security of one s belongings a href http www,1
i am feeling lighter and less inhibited every single day,0
i feel terrified of the future,4
i began training in january or at least mentally preparing myself to train and can remember specifically feeling apprehensive about the running a spring marathon,4
i would feel lucky to call any of the materials and kits on your site mine they are just beautifully curated,1
im feeling adventurous i get the philips better lemon chicken,1
i feel like ive had to fake my feelings a lot more often then i would have liked to,0
i was ready to meet mom in the airport and feel her ever supportive arms around me,2
i feel absolutely shitty,0
i kept my laptop close searching for jobs that i could build a career out of and looking for those all important christmas recipes to make this year feel a little more special,1
i was feeling strong and sassy so i went out back and got the aluminum ladder and carried it up to the house,1
i usually feel regretful and guilty after the quarrel usually its me who turns the talk into a quarrel i yell loudly and throw the things beside me with mama,0
i start to feel like im getting over the death of my beloved cat timmy and when i get used to the idea of only seeing my mum maybe twice a ytear from now on and justwhen i start planning for my futrue and happy timesa ahead i start efeeling like this again,2
i shouldnt be afraid to go out in public and feel paranoid because ive done nothing wrong,4
i get nothing and i really want to feel like if someone likes me for who i am not for my stubborn sister,3
i have to get it in my head that i didnt do anything wrong its just of them have feelings for someone else and one just doesnt appear very considerate,2
i woke up feeling ok but i had a weird feeling about the run today,1
i feel i am beyond pissed off disappointed frustrated with myself,3
i still enjoy it because i do not feel like i am being beaten over the head with a you are dumb and can t figure this out on your own stick,0
i am feeling a lil groggy from the cough medicine,0
i feel the precious metals sector will be starting something like this in the near futures and possibly it has already started as seen in the rising volume on the down days,1
i just feel like an awful mommy,0
i feel like im being punished for wanting to make some money,0
i am blank completely i am just feeling every emotion as precious would feel it and how she should feel it,1
i never worry about having to repay you or feel burdened when i couldn t afford something because we always manage to understand and have fun despite being broke which is a lot of the time,0
i feel like its a lifestyle change i could genuinely live with without feeling deprived,0
