text,label
i don t feel like i am dissatisfied because i don t have things i think i am dissatisfied because not much is changing in me and i still feel bad at times,3
i am feeling hopeful and looking forward once again,1
i just feel skeptical,4
i feel for my beloved that is reciprocated,2
im just sick of feeling unwelcome here,0
i feel homesick near to the end of the last week in thailand,0
i started feeling reluctant to go because i wanted to spend some time with my family before i left,4
i feel passionate about and want to convey in my stories are not suburban north america but the truths of who god is are bigger than geography,1
i feel extremely lucky and blessed to work with such outstanding young ladies,1
i am the one feeling punished,0
i feel as if i m one of the stubborn ones,3
i feel like parts of me that were repressed and buried for so long are just now surfacing,0
i am feeling sorry for myself because someone made fun of my outfit,0
i know im feeling agitated as it is from a side effect of the too high dose,4
i feel that it could have been a more successful outcome had i explored new styles but kept it close to me and remained myself,1
i guess ive been feeling agitated lately,3
i make new friends in the process i dont feel too slutty lol,2
im feeling extraordinarily dazed and bewildered this arvo for no particular reason and my muscles all hurt even though i dont actually have any,5
i says pressing his torso against siwons and bringing their faces close enough that he can feel siwons agitated breath,3
i feel so ugly and ashamed img src http s,0
i am normally very able to express how i feel particularly when im excited or happy,1
i have been so busy i feel like i have free time at home,1
i like the idea of wearing things that are comfortable and make me feel cute,1
i had a sudden feeling of missed opportunity here i could have asked how their evening was going,0
im feeling doodly playful artistic hungry puzzled trendy stellar and wonderful,1
i have the feeling i am going to be tortured tonight,4
i could curse swear be angry be sad be happy be moody etc etc on the things i write just because i feel kinda disturbed with the search queries displayed on the dashboard that containing my name full name blog s name or my usual nickname,0
i have to deal with the fact that society wants everyone to feel like they re in fake love for a couple of days and then we can all forget what emotions are,0
i am merely a man who will feel humiliated whenever i am intimidated by you,0
i feel kind of embarrassed writing this that my ladybits must have gotten frozen or something in the swim as it felt like they were numb and didnt thaw out for a good miles,0
i feel a little dull,0
i am very stubborn but i feel like if i am going to be stubborn it should be in a manner that is going to help me,3
i go to tell someone to feel her kick she gets shy and stops,4
im feeling a bit shaken but not stirred nice bond reference ehh,4
i think about these two ways of looking at life the more i feel convinced that it is sensible to see it as a lease rather than a gift,1
i always feel a bit triumphant when i find a gift for my youngest brother that is not a movie or a video game or anything similar to those two,1
i feel sad and discouraged,0
i feel burdened by my own expectations,0
i would feel myself being a little bit repressed in my creativity and ideas would not come to me as easily,0
i feel intimidated by the great women in my family tree,4
i feel pretty successful with that but theres still something in me that says you can do more,1
i guess im just really feeling the heat lately and sweet baby rays buffalo sauce brings it baby,1
i think that even just understanding that there s that history behind it it lends to the explanation of where it s being projected from so it s kind of important to some degree and i never feel offended by people questioning that,3
i think this may be the reason i would want to fly back to uae because there i can be oblivious of these conflicts that plague me conflicts that i feel helpless resolving,0
im feeling brave today so here goes,1
i don t even feel faithful about all this,2
i have found this site to be a huge help to keep my in the moment when im feeling stressed or missing drinking,0
im feeling selfish right now because i want that time back,3
i feel affectionate toward the friends ive made online and admire their spirits and talents,2
i also potted up this fuchsia grown from a cutting last year my first attempt at taking cuttings and of which im feeling rather pleased with myself,1
i feel this ad does i m not impressed,5
i feel ugly to my fellow humans,0
i want to feel inspired on the job,1
im feeling very blessed to live in a state with such beautiful sights like virginia has,1
i didnt even realise just how out of control i have been feeling lately until i had a week of calm to gain some much needed perspective,1
i watched on thanksgiving this morning i am feeling doubly blessed for what god has given me,2
i can look back likely years from now realize the impact of several lessons learned through the course of a season that just had that feel of something special and know that even if nothing in my tenure comes close to this again i will always have,1
i actually feel pretty good,1
i still don t feel so hot i said as aj frowned,2
i didnt feel there was anything special about it,1
i feel awful for so but he has to know im not lying about what the kid does sometimes if hell stoop to pending on himself,0
i am such a private person and although i won t be going into anything too personal i m feeling anxious just writing this,4
i prayed to trust god with my desire to feel a divine sense of home,1
i ain t shot a bitch since this morning so i m feelin a little gun horny,2
i feel like i m accomplishing something and when i feel passionate about life,1
i have a serious question for some of you why do you feel it is ok to support a healthcare plan that tramples on anothers beliefs,1
when i was about six years old,4
i believe him when he says it was a mistake i feel hes being sincere but i want him to be sure as to what he wants from me,1
ive continued to feel energetic most of the time and am trying to keep up my times of working out per week did the jillian workout this week and was very sore,1
i know i shouldn t feel offended but i do,3
i get the feeling im watching to see charlie be charming and zen rather than because i actually care what hes going through,1
im usually feeling very blank and i know i posted already today but it was all bachelorette talk and i guess i had more to say,0
i dont really know why im bothering to do my homework but i get the feeling that it will be in vain,0
im feeling hideously guily and somewhat naughty doing this in work time,2
i feel depressed my old sexual demon returns and that banishes my despair in mad displays of wild exhibitionism april part two a href http newrhinegargoyle,0
im sure they feel the more caring loving people in the kids lives the better,2
i feel like a bitchy selfish idiot,3
i don t believe these feelings can be blamed solely on the lack of empathy towards family life by government policy makers and employers which the analysis on this survey would seem to suggest,0
i realise that although i originally started this blog for a specific purpose it has really grown beyond that and i shouldnt feel pressured to writing about specific things,4
i feel very blessed and lucky to have found a true old soul,1
i am so incredibly thankful for the temple and for the blessings the promises and especially the feeling that comes over me when i am either inside this amazing building or simply when i drive by,1
im feeling very optimistic about my stash reducing abilities this month too so you can expect a really big empties post next time,1
i look like i worry that i will always feel inadequate,0
i feel like a blank sheet,0
i have a feeling she is going to be an amazing artist like her daddy and uncles,1
i feel so hopeless and usually just want o scream,0
i do feel bad,0
i have been feeling discouraged lately but a quick visit from my sister and nephew this weekend definitely cheered me up,0
i feel low and lost and lonely on a grey day,0
i cannot stop loving you and it just feels amazing it really fills my heart so let me,1
ive been feeling weepy and sensitive today as time rolls towards the anniversary of my fathers death,0
i may feel relieved or satisfied but i am probably not having fun,1
i have seen you fall asleep climbing back into bed before you were even horizontal and now i am awake and my neck is cramped and i am feeling hostile and cheated,3
i honestly never expected to feel so vulnerable,4
i just wanted to write this post because i m sure like myself there are many of us struggling with the same problem feeling deprived and isolated on such a restricted program but i hope you realize that you are doing it to yourself and you don t have to feel that way at all,0
i have this nasty feeling that i am being an ungrateful wretch,0
i am constantly overwhelmed by the feeling that i am not smart enough not pretty enough not nice enough not talented enough and worst of all that i am not doing enough to make any of these things better,1
i love tv wall mounts and feel that they are a handsome advance that not only looks great but saves a ton of plot if you are attracted in receiving one don t just put down roots with the first one that you see like most population do,1
i often find myself in a hostile environment my leaves feel damaged my blossoms die on the vine,0
i will actually feel comfortable speaking to others in just japanese i feel pretty happy about my current progress,1
i am still feeling extremely damaged from many different events some of them seeming to repeat themselves i havent given up nor do i ever plan on,0
i also feel paranoid that everyone is listening to my phone conversations whats that all about,4
i was feeling make it all worthwhile she has been loving on her daddy and she let him feed her breakfast she snuggled up in the chair with spencer and played with him she is walking more and she has officially been in all of her grandparents arms with a smile on her face,1
i do not feel insecure or unsafe,4
i could have just kept going but i could tell that she was feeling really defeated and needed a friend,0
i feel heartbroken and worried and i have a wicked headache,0
i totally and completely feel free doing that is amongst like minded souls,1
i feel like this is another one of those dresses that looks really cool from far away but when i take a closer look i dont like it as much,1
im feeling pathetic i cant take rejection why wont you call me,0
i feel like i am living without my apendages and all vital organs,1
i occasionally find myself feeling desiring the room and time to distill and slowly mull over consider and explore the rich complexities that surround the foggy notion that there is an objective definitive knowledge of tantric buddhism,1
i feel intimidated by other girls acne getting rid of pimples,4
i feel like a woman should be respected at all times therefore i made the right decision he said,1
i was out shopping with a friend the other day and she asked how i was feeling about the book coming out and i said i was terrified and she asked why,4
i thought id try to demonstrate the difference as i know if i hadnt seen it for myself i may still be feeling doubtful,4
i was in the bathroom i had sat down to pee it was to make me feel submissive again per instructions,0
i don t want you to feel left out o faithful reader i love you too,2
i feel hes being very casual with my entire future,1
i guess were annoyed agiatated and my sis feels hated darn cos i told her shes a geek i love you amy,3
i feel somewhat victimized,0
i feel so peaceful so i know i made the right decision,1
i feel so cute,1
i understand and appreciate the concern for safety i feel that the real focus of the market the vendors has been ignored,0
i feel sympathetic enough to call him off,2
i begun to feel distressed for you,4
i want to feel and maybe something i am feeling convinced myself of the nvm state of mind i am in after due deliberations,1
i i just feel so self content,1
i still feel funny,5
i was feeling drained before i even sat in the chair,0
i sense and keeps catching my attention is the feeling of the beloved s love pouring out of and through me touching those i encounter in a palpably strong way,2
i honestly feel a little bit relieved,1
i feel so welcomed,1
i was already going to feel giggly about it,1
i feel like im a shy enormous pink flamingo man,4
i still love my so and wish the best for him i can no longer tolerate the effect that bm has on our lives and the fact that is has turned my so into a bitter angry person who is not always particularly kind to the people around him when he is feeling stressed,0
i wish i didnt feel this afraid to talk to new people,4
i attended a session in the pub afterwards and i m feeling a bit tender this morning,2
id feel very sympathetic but then again its not like what the current situation seems,2
i doubt theres any greater reluctance by federal authorities to employ tear gas and plain force if they feel threatened,4
i began to feel if i keep on supporting this system i became a part of the blood sucking everything for profit machinery,1
i was already packed didn t want to wait around for her to talk to her friend was feeling irritable tired and eventually gave up on trying to go in the first place made me feel more down about my situation,3
i was angry and feeling so disillusioned,0
i finally left feeling judged and ridiculed because i am intelligent,1
i feel terrible and sexist whenever im in a group of women and they start talking about dieting and my brain automatically drops the t,0
i know its not always as great an experience as ive set out here but if youre feeling a bit jaded and would like to remind yourself of what it was about teaching that attracted you in the first place you might like to give it a thought,0
im here to tell you you arent alone if you feel vulnerable,4
i feel like i should try to calm her down shes been very good to me since the games ended but i can see katniss getting more and more tense with every schedule adjustment,1
i get what williams is doing in imping other artists but i still feel that its more of a distraction than it is clever and the murder mystery plot is a decent hook but turns out to be wholly unsurprising,1
i can cry and feel bad without an explanation at all,0
i am starting to feel compassionate towards roslin again,2
i feel like you re important to me,1
i almost feel hated by everyone,3
i always feel slightly embarrassed,0
i was feeling extremely anxious,4
i am feeling lost for not being on a regimented strength program,0
i feel horrible rel bookmark permalink,0
i feel slightly like a traitor admitting that i really liked the new place,2
i am sure at least i hope so that the woman who responded by saying so that he could help out with the kids also feel this way but what surprised me was that all the reasons i listed above were second,5
i feel as though my sub arguments are stronger and i support my claims better than i did in the beginning,1
i feel gutted now i am joyful and at the same time enraged,1
i myself smiling through loving simple dialog child logic explain situation feelings it s funny,5
i feel like its an excuse for being boring as an individual or lack of confidence in your individuality,0
i was able to work in the studio all week though im feeling a bit gloomy about how slowly things seem to be progressing,0
ill go because it warms my muscles and i always laugh in the midst of our quirky little inter generational exercise family and after six months im a regular which reminds me that ive accomplished the epic feat of no longer feeling in some way intimidated when i go to the gym,4
i feel like there needs to be a disclaimer that i am in no way romanticising the shitty aspects of this pairing okay it is fucked up beyond belief summary castiel holds the world in the palm of his hand,0
i need to do the best i possibly can do and even when i get out at i feel too listless to study like right now,0
i guess it s that whole i need a hobby thing to feel worthwhile smart and important,1
i feel embarrassment and shame of being victimized,0
i feel like each kid left school this year with at least three pieces they were really proud of,1
i feel that we are heading for an abyss that has been created by the greedy the too greedy and the far too greedy,3
i am feeling a little uncertain about my skills in the birthday party arena,4
i was feeling pretty grumpy at this point but for whatever reason seeing this flower made me very happy,3
i feel as if i prepare for hurricanes every day of the week and at the end of the night these three precious storms leave their trail throughout my home,1
i am feeling a lil bit gloomy,0
i am fascinated with the structure and function of the brain its so incredible that everything we think and feel all our memories and emotions are created and stored in this strange convoluted structure,4
i need to go and im feeling a longing inside at that point for him,2
i feel pathetic even reading this and thoughts like wow i am such a loser shuffle across my mind,0
i am feeling jaded,0
i still feel incredibly frustrated by it,3
i came across the exchange point feeling strong,1
i feel can be really popular in the underground if they get themselves out there and thank god for this i m looking at you toby and tunji,1
i worried over the feeling of supposed to being at church but rich and dr,1
i thought how great it must feel for the author to have created a story that has been so popular and now to come back with the story of the beginnings,1
i feel even more beaten down without the encouragement and am afraid i might try to hide from the world in bed feeling like i ve already lost,0
i feel more inspired to get back into the mindset of putting the good stuff into my body,1
i wound up driving to him getting butterflies like a teenager when we kissed then feeling rotten for a week after expecting him to call,0
i was already nervous about this match but by the time i got there i was simply feeling glad to be alive after a treacherous journey through foul weather,1
im feeling pretty smug about going down yesterday instead of waiting,1
i feel so unimportant insignificant like im slipping through the gaps between his fingers and he doesnt care,0
i feel that wanatribe may become a vital link in my writing network,1
i know like the recommendation function in modern web shops while it feels a little bit strange to see the product you ve just searched for in a web shop on a totally different site s advertising,4
im in confuse and feeling so blank rite now,0
i love the combination of lavender and orange scent but feel free to substitute any other fragrance oil or essential oils that you wish,1
i feel low confidence sometimes,0
i feel someone has been wronged when i feel i have been wronged or when i get riled up against an action i find offensive i unsheathe my sword and good lord you better look out,3
i feel very apprehensive to adopt labels and to even identify myself as queer it seems that im still quite unclear on that subject and it keeps me feeling separate from the queer community like joel,4
im not necessarily sure what but something in the education system must change or students can feel anxiety and pressure with needing to be flawless with their vast knowledge of the world,1
i moved away he said something that made me feel violent but its something i still cant make out,3
i feel pressured to talk to them,4
i dont know where and when i can feel the thrill and im scared that im going to miss it,4
i dunno i just feel that i started this blog a little shaky as i wasnt really sure about what sort of audience i was addressing or anything,4
im feeling more festive,1
i thought about my own depression about the negative thoughts ive had lately and how i can intervene in those thoughts to help myself not feel so depressed,0
i sing decently but coming from the kind of family i do i always feel like im less talented so ive never really tried to learn as such,1
i feel like i still have some valuable information from that perspective,1
i feel sorry for writers because even drecky writers can pay to have a pretty good cover done for them,0
i got off in my previous post about how much the app maker leeches upset me at this conference and so i feel like i should mention who i was most impressed with there,5
i am feeling quite disorganised and distracted and i wish i could answer some of the questions i seem to be unable to block out or forget or answer with logical answers uuuugh,3
ive been feeling so jaded,0
i feel so all alone no ones gonna fix me when im broke how do you cry with inanimate eyes,0
i feel so profoundly blessed to finally be in a good place of life to be at peace to know what i would want in a husband and to be able to recognize it quickly,1
im going at it with so much gusto i feel aching in my body already,0
i do not see but could feel that she is someone i am very reluctant to let go,4
i could feel the cool air marillac was like a giant residential freezer flow with more ease through the teeny extra hole in my right nostril,1
i feel like everyone who will be caring for zach in some way needs to be at least slightly educated in what is ok and what is not,2
i feel restless otherwise known as useless or lazy when i take long breaks from writing,4
i feel really burdened by this days challenge,0
i began to feel agitated because i wanted to buy ewan some food and medicine before i left,3
i feel that she was trying to hurt me,0
i feel that karma punished me because i don t know the meaning of contentment img src http www,0
i feel that way but yeah i do have a problem in trusting especially guys,1
i was feeling pretty anxious and overwhelmed as a friend rightly noted probably because i was on a boat with my mom grandmother and great aunt and no where to flee except the damn cold baltic sea,4
i probably would have bailed at the half way mark when i was feeling quite low physically and mentally,0
i am living a joyful life and i feel this divine beings as part of my daily life,1
i was dwelling on the current state of my life i was unsure about my place in life and what i was going to do with it and i was feeling a bit bitter at god because of it,3
i just feel so listless and lost,0
i feel hated but i don t care,3
im alternating between felling optimistic and feeling doomed,0
i wanted both but i feel greedy,3
i was an outsider and i never felt part as i was new that made me feel disheartened,0
i needed to clear my head he tells him and sighs when he feels gentle fingers in his hair,2
i was that i bombed that first interview i left the second interview feeling pretty fan freaking tastic,1
i am feeling rather triumphant that i decided to disagree with davids notion that the real peak was further on and decided to give the side trail a chance,1
i feel so depressed when i m not with her and when i think about her because it is so destroyed i just think i should move on,0
i then had my watch from am this morning but was feeling just fine so did an additional hour so my dad could rest a little longer,1
i feel a bit safer now in using the motivator that works and trusting that i will be able to use my other motivators and combat other parts of the ed if i am patient and strong,1
i have tryed different ways for people to notice me but i feel fake doing them because none of it is myself,0
i hope you feel a little more glamorous after reading todays pinterest loves,1
i leave in four weeks and im starting to feel a little heartbroken at the thought of it,0
i was feeling bouncy so i added a few of my go to tangles around it i rather like the spiraling effect achieved,1
i feel very lucky to live in a warm home with the three people i love most,1
ive been coughing for the past few days now and my stomach muscles are definitely feeling rather tender the sore throat is a new development as is the runny nose,2
i write what i feel if you get annoyed and sick of this simply close the tab,3
i feeling shy,4
i am new to this forum and i wish to have extended friends and acquaintances here as i feel this is quite a friendly forum,1
im feeling determined now to push through any hiccups and reach my ultimate goal of being within the healthy weight range kg for my height,1
i am feeling doubtful confused lost and what not,4
i consistently ask myself especially when i am feeling low or having doubts about my future,0
i feel like im falling out of love with him in a way and not in a romantic sense,2
i feel very humiliated but also even more turned on,0
i am still working on how to get past feeling deprived by saying no to foods that are fat sugar filled,0
ive been really angry with r and i feel like an idiot for trusting him in the first place,1
i feel so lame complaining that for minutes i get some blurry vision and then have to take it easy the rest of the day,0
i don t have the longevity or experience in the field to get a feeling for that and i m curious as to what the speculation might be,5
i loved feeling lily move and have missed it so much,0
i is celebrated with great fan fare which happens to be january th or october nd disregarding here of course the rare sense of gandhigiri euphoria generated by an unexpected source such as munnabhai we come across the inescapable phrase which i feel has been much abused a hindu fanatic,0
i wake up real life husband i feel melancholy towards day,0
i have been struggling with this feeling of being damaged,0
i feel this is very dangerous,3
im not feeling quite so adventurous i might just find a quiet spot to read,1
